ID,name,artist,style,language,BPM,instrument,lyrics,label,emotion_json,dominant_emotion
1803546870,tolerate it,Taylor Swift,,English,,,"作词 : Taylor Swift/Aaron Dessner 作曲 : Taylor Swift/Aaron Dessner 编曲 : Aaron Dessner/James McAlister/Bryan Devendorf/布莱斯 · 戴斯纳 制作人 : Aaron Dessner I sit and watch you reading with your head low I wake and watch you breathing with your eyes closed I sit and watch you I notice everything you do or don't do You're so much older and wiser and I I wait by the door like I'm just a kid Use my best colors for your portrait Lay the table with the fancy shit And watch you tolerate it If it's all in my head tell me now Tell me I've got it wrong somehow I know my love should be celebrated But you tolerate it I greet you with a battle hero's welcome I take your indiscretions all in good fun I sit and listen I polish plates until they gleam and glisten You're so much older and wiser and I I wait by the door like I'm just a kid Use my best colors for your portrait Lay the table with the fancy shit And watch you tolerate it If it's all in my head tell me now Tell me I've got it wrong somehow I know my love should be celebrated But you tolerate it While you were out building other worlds, where was I? Where's that man who'd throw blankets over my barbed wire? I made you my temple, my mural, my sky Now I'm begging for footnotes in the story of your life Drawing hearts in the byline Always taking up too much space or time You assume I'm fine, but what would you do if I Break free and leave us in ruins Took this dagger in me and removed it Gain the weight of you then lose it Believe me, I could do it If it's all in my head tell me now Tell me I've got it wrong somehow I know my love should be celebrated But you tolerate it I sit and watch you",,"{""happy"": 0.091, ""sad"": 0.273, ""calm"": 0.136, ""romantic"": 0.182, ""dark"": 0.227, ""aggressive"": 0.091}",sad
503207093,...Ready For It?,Taylor Swift,,English,,,"作词 : Ali Payami/Karl Johan Schuster/Max Martin/Taylor Swift 作曲 : Ali Payami/Karl Johan Schuster/Max Martin/Taylor Swift Knew he was a killer first time that I saw him Wonder how many girls he had loved and left haunted But if he's a ghost, then I can be a phantom Holdin' him for ransom Some, some boys are tryin' too hard He don't try at all, though Younger than my exes but he act like such a man, so I see nothing better, I keep him forever Like a vendetta-ta I-I-I see how this is gon' go Touch me and you'll never be alone I-Island breeze and lights down low No one has to know In the middle of the night, in my dreams You should see the things we do, baby In the middle of the night, in my dreams I know I'm gonna be with you So I take my time Are you ready for it? Knew I was a robber first time that he saw me Stealing hearts and running off and never saying sorry But if I'm a thief, then he can join the heist And we'll move to an island-and And he can be my jailer, ""Burton to this Taylor"" Every lover known in comparison is a failure I forget their names now, I'm so very tame now Never be the same now, now I-I-I see how this is gon' go Touch me and you'll never be alone I-Island breeze and lights down low No one has to know (No one has to know) In the middle of the night, in my dreams You should see the things we do, baby In the middle of the night in my dreams I know I'm gonna be with you So I take my time Are you ready for it? Ooh, are you ready for it? Baby, let the games begin Let the games begin Let the games begin Baby, let the games begin Let the games begin Let the games begin I-I-I see how this is gon' go Touch me and you'll never be alone I-Island breeze and lights down low No one has to know In the middle of the night, in my dreams You should see the things we do, baby In the middle of the night, in my dreams I know I'm gonna be with you So I take my time In the middle of the night Baby, let the games begin Let the games begin Let the games begin Are you ready for it? Baby, let the games begin Let the games begin Let the games begin Are you ready for it?",,"{""happy"": 0.13, ""sad"": 0.087, ""calm"": 0.174, ""romantic"": 0.261, ""dark"": 0.217, ""aggressive"": 0.13}",romantic
516818336,Delicate,Taylor Swift,,English,,,"作词 : Taylor Swift/Max Martin/Shellback 作曲 : Taylor Swift/Max Martin/Shellback This ain't for the best My reputation's never been worse, so You must like me for me… We can't make Any promises now, can we, babe? But you can make me a drink Dive bar on the east side, where you at? Phone lights up my nightstand in the black Come here, you can meet me in the back Dark jeans and your Nikes, look at you Oh damn, never seen that color blue Just think of the fun things we could do 'Cause I like you This ain't for the best My reputation's never been worse, so You must like me for me… Yeah, I want you We can't make Any promises now, can we, babe? But you can make me a drink Is it cool that I said all that? Is it chill that you're in my head? 'Cause I know that it's delicate (delicate) Is it cool that I said all that? Is it too soon to do this yet? 'Cause I know that it's delicate Isn't it? Isn't it? Isn't it? Isn't it? Isn't it? Isn't it? Isn't it? Isn't it delicate? Third floor on the west side, me and you Handsome, you're a mansion with a view Do the girls back home touch you like I do? Long night, with your hands up in my hair Echoes of your footsteps on the stairs Stay here, honey, I don't wanna share 'Cause I like you This ain't for the best My reputation's never been worse, so You must like me for me… Yeah, I want you We can't make Any promises now, can we, babe? But you can make me a drink Is it cool that I said all that? Is it chill that you're in my head? 'Cause I know that it's delicate (delicate) Is it cool that I said all that? Is it too soon to do this yet? 'Cause I know that it's delicate Isn't it? Isn't it? Isn't it? Isn't it? Isn't it? Isn't it? Isn't it? Isn't it delicate? Sometimes I wonder when you sleep Are you ever dreaming of me? Sometimes when I look into your eyes I pretend you're mine, all the damn time 'Cause I like you Is it cool that I said all that? Is it chill that you're in my head? 'Cause I know that it's delicate (delicate) (Yeah, I want you) Is it cool that I said all that? Is it too soon to do this yet? 'Cause I know that it's delicate (delicate) 'Cause I like you Is it cool that I said all that? (Isn't it?) Is it chill that you're in my head? (Isn't it? Isn't it?) 'Cause I know that it's delicate (Isn't it?) (Yeah, I want you) Is it cool that I said all that? (Isn't it?) Is it too soon to do this yet? (Isn't it? Isn't it?) 'Cause I know that it's delicate Isn't it delicate?",,"{""happy"": 0.176, ""sad"": 0.118, ""calm"": 0.235, ""romantic"": 0.412, ""dark"": 0.059, ""aggressive"": 0.0}",romantic
516823325,Don't Blame Me,Taylor Swift,,English,,,"作词 : Taylor Swift/Max Martin/Shellback 作曲 : Taylor Swift/Max Martin/Shellback Don't blame me, love made me crazy If it doesn't, you ain't doin' it right Lord, save me, my drug is my baby I'll be usin' for the rest of my life I've been breakin' hearts a long time, and Toyin' with them older guys Just play things for me to use Something happened for the first time, in The darkest little paradise, shakin' Pacin', I just need you For you, I would cross the line I would waste my time I would lose my mind They say she's gone too far this time Don't blame me, your love made me crazy If it doesn't, you ain't doin' it right Lord, save me, my drug is my baby I'll be usin' for the rest of my life Don't blame me, love made me crazy If it doesn't, you ain't doin' it right Oh, Lord, save me, my drug is my baby I'll be usin' for the rest of my life My name is whatever you decide And I'm just gonna call you mine I'm insane, but I'm your baby (your baby) Echoes of your name inside my mind Halo, hiding my obsession I once was poison ivy, but now I'm your daisy And baby, for you, I would fall from grace Just to touch your face If you walk away I'd beg you on my knees to stay Don't blame me, your love made me crazy If it doesn't, you ain't doin' it right Lord, save me, my drug is my baby I'll be usin' for the rest of my life Don't blame me, your love made me crazy If it doesn't, you ain't doin' it right Oh, Lord, save me, my drug is my baby I'll be usin' for the rest of my life I get so high, oh Every time, yeah, every time you're lovin' me You're lovin' me Trip of my life, oh Every time, yeah, every time you're touchin' me You're touchin' me Every time, yeah, every time you're lovin' me Oh, Lord, save me My drug is my baby I'd be usin' for the rest of my life (Usin' for the rest of my life, oh) Don't blame me, love made me crazy If it doesn't, you ain't doin' it right (doin' it right, no) Lord, save me, my drug is my baby I'll be usin' for the rest of my life, oh Don't blame me, your love made me crazy If it doesn't, you ain't doin' it right (you ain't doin' it...) Oh, Lord, save me, my drug is my baby I'll be usin' for the rest of my life (I'll be usin', I'll be usin') I get so high, oh Every time, yeah, every time you're lovin' me You're lovin' me Oh, Lord, save me My drug is my baby I'll be usin' for the rest of my life",,"{""happy"": 0.136, ""sad"": 0.182, ""calm"": 0.091, ""romantic"": 0.318, ""dark"": 0.227, ""aggressive"": 0.045}",romantic
501133611,Look What You Made Me Do,Taylor Swift,,English,,,"作词 : Taylor Swift/Jack Antonoff/Richard Fairbrass/Fred Fairbrass/Rob Manzoli 作曲 : Taylor Swift/Jack Antonoff/Richard Fairbrass/Fred Fairbrass/Rob Manzoli I don't like your little games Don't like your tilted stage The role you made me play Of the fool, no, I don't like you I don't like your perfect crime How you laugh when you lie You said the gun was mine Isn't cool, no, I don't like you (oh!) But I got smarter, I got harder in the nick of time Honey, I rose up from the dead, I do it all the time I’ve got a list of names and yours is in red, underlined I check it once, then I check it twice, oh! Ohh, look what you made me do Look what you made me do Look what you just made me do Look what you just made me do Ohh, look what you made me do Look what you made me do Look what you just made me do Look what you just made me do I don't like your kingdom keys They once belonged to me You ask me for a place to sleep Locked me out and threw a feast (what?) The world moves on, another day, another drama, drama But not for me, not for me, all I think about is karma And then the world moves on but one thing's for sure Maybe I got mine, but you'll all get yours But I got smarter, I got harder in the nick of time Honey, I rose up from the dead, I do it all the time I’ve got a list of names and yours is in red, underlined I check it once, then I check it twice, oh! Ohh, look what you made me do Look what you made me do Look what you just made me do Look what you just made me do Ohh, look what you made me do Look what you made me do Look what you just made me do Look what you just made me do I don't trust nobody and nobody trusts me I'll be the actress starring in your bad dreams I don't trust nobody and nobody trusts me I'll be the actress starring in your bad dreams I don't trust nobody and nobody trusts me I'll be the actress starring in your bad dreams I don't trust nobody and nobody trusts me I'll be the actress starring in your bad dreams (Look what you made me do) (Look what you made me do) ”I’m sorry, the old Taylor can't come to the phone right now. ”Why?” ”Oh, 'cause she's dead!"" (ohh!) Ooh, look what you made me do Look what you made me do Look what you just made me do Look what you just made me do Ooh, look what you made me do Look what you made me do Look what you just made me do Look what you just made me do Ooh, look what you made me do Look what you made me do Look what you just made me do Look what you just made me do Ooh, look what you made me do Look what you made me do Look what you just made me do Look what you just made me do",,"{""happy"": 0.042, ""sad"": 0.25, ""calm"": 0.083, ""romantic"": 0.0, ""dark"": 0.292, ""aggressive"": 0.333}",aggressive
2059790521,Enchanted (Taylor's Version),Taylor Swift,,English,,,"作词 : Taylor Swift 作曲 : Taylor Swift 编曲 : Derek Garten 制作人 : Taylor Swift/Christopher Rowe There I was again tonight forcing laughter faking smiles Same old tired lonely place Walls of insincerity Shifting eyes and vacancy vanished when I saw your face All I can say is it was enchanting to meet you Your eyes whispered have we met Across the room your silhouette starts to make its way to me The playful conversation starts Counter all your quick remarks like passing notes in secrecy And it was enchanting to meet you All I can say is I was enchanted to meet you This night is sparkling don't you let it go I'm wonderstruck blushing all the way home I'll spend forever wondering if you knew I was enchanted to meet you The lingering question kept me up 2 am who do you love I wonder tillI'm wide awake And now I'm pacing back and forth wishing you were at my door I'd open up and you would say"" Hey"" It was enchanting to meet you All I know is I was enchanted to meet you This night is sparkling don't you let it go I'm wonderstruck blushing all the way home I'll spend forever wondering if you knew This night is flawless don't you let it go I'm wonderstruck dancing around all alone I'll spend forever wondering if you knew I was enchanted to meet you This is me praying that this was the very first page Not where the story line ends My thoughts will echo your name until I see you again These are the words I held back as I was leaving too soon I was enchanted to meet you Please don't be in love with someone else Please don't have somebody waiting on you Please don't be in love with someone else Please don't have somebody waiting on you This night is sparkling don't you let it go I'm wonderstruck blushing all the way home I'll spend forever wondering if you knew This night is flawless don't you let it go I'm wonderstruck dancing around all alone I'll spend forever wondering if you knew I was enchanted to meet you Please don't be in love with someone else Please don't have somebody waiting on you",,"{""happy"": 0.25, ""sad"": 0.187, ""calm"": 0.125, ""romantic"": 0.375, ""dark"": 0.062, ""aggressive"": 0.0}",romantic
1891454320,22 (Taylor's Version),Taylor Swift,,English,,,"作词 : Taylor Swift/Max Martin/Shellback 作曲 : Taylor Swift/Max Martin/Shellback 编曲 : Dan Burns/Matt Billingslea 制作人 : Taylor Swift/Christopher Rowe/Shellback It feels like a perfect night To dress up like hipsters And make fun of our exes, uh-uh, uh-uh It feels like a perfect night For breakfast at midnight To fall in love with strangers, uh-uh, uh-uh Yeah We're happy, free, confused, and lonely at the same time It's miserable and magical, oh, yeah Tonight's the night when we forget about the deadlines It's time, oh-oh I don't know about you, but I'm feeling 22 Everything will be alright if you keep me next to you You don't know about me, but I'll bet you want to Everything will be alright if we just keep dancing like we're 22, 22 It seems like one of those nights This place is too crowded Too many cool kids, uh-uh, uh-uh (Who's Taylor Swift, anyway? Ew) It seems like one of those nights We ditch the whole scene And end up dreaming Instead of sleeping Yeah We're happy, free, confused, and lonely in the best way It's miserable and magical, oh, yeah Tonight's the night when we forget about the heartbreaks It's time, oh-oh (Hey!) I don't know about you, but I'm feeling 22 Everything will be alright (Ooh) if you keep me next to you You don't know about me, but I'll bet you want to Everything will be alright if (Alright) We just keep dancing like we're 22 (Oh, oh, oh, oh, oh) 22 (I don't know about you) 22, 22 It feels like one of those nights We ditch the whole scene It feels like one of those nights We won't be sleeping It feels like one of those nights You look like bad news I gotta have you I gotta have you Ooh, ooh, yeah (Hey!) I don't know about you, but I'm feeling 22 Everything will be alright if (Ooh) you keep me next to you You don't know about me, but I'll bet you want to Everything will be alright if we just keep dancing like we're 22 (Whoa, oh) 22 (Dancing like) 22 (Yeah, yeah), 22, (Yeah, yeah, yeah) It feels like one of those nights We ditch the whole scene It feels like one of those nights We won't be sleeping It feels like one of those nights You look like bad news I gotta have you I gotta have you",,"{""happy"": 0.4, ""sad"": 0.133, ""calm"": 0.067, ""romantic"": 0.267, ""dark"": 0.133, ""aggressive"": 0.0}",happy
1891456102,We Are Never Ever Getting Back Together (Taylor's Version),Taylor Swift,,English,,,"作词 : Taylor Swift/Max Martin/Shellback 作曲 : Taylor Swift/Max Martin/Shellback 编曲 : Dan Burns/Matt Billingslea 制作人 : Taylor Swift/Christopher Rowe/Shellback I remember when we broke up the first time Saying, ""This is it, I've had enough,"" 'cause like We hadn't seen each other in a month When you said you needed space (What?) Then you come around again and say ""Baby, I miss you and I swear I'm gonna change, trust me"" Remember how that lasted for a day? I say, ""I hate you,"" we break up, you call me, I love you Ooh-ooh-ooh-ooh-ooh We called it off again last night, but Ooh-ooh-ooh-ooh-ooh This time, I'm telling you, I'm telling you We are never, ever, ever getting back together We are never, ever, ever getting back together You go talk to your friends, talk to my friends, talk to me But we are never, ever, ever, ever Getting back together Like, ever I'm really gonna miss you picking fights And me falling for it, screaming that I'm right And you would hide away and find your peace of mind With some indie record that's much cooler than mine Ooh-ooh-ooh-ooh-ooh You called me up again tonight, but Ooh-ooh-ooh-ooh-ooh This time, I'm telling you, I'm telling you We (We) are never, ever, ever getting back together We are never, ever, ever getting back together You go talk to your friends, talk to my friends, talk to me (Talk to me) But we are never, ever, ever, ever Getting back together Ooh-ooh-ooh-ooh-ooh (Yeah) Ooh-ooh-ooh-ooh-ooh-ooh (Yeah) Ooh-ooh-ooh-ooh-ooh (Yeah) Oh-oh-oh I used to think that we were forever, ever And I used to say, ""Never say never"" Ugh, so he calls me up and he's like, ""I still love you"" And I'm like, ""I'm just, I mean, this is exhausting, you know? Like, we are never getting back together, like, ever"" (No) We are never, ever, ever getting back together We are never, ever, ever (Ooh) getting back together You go talk to your friends, talk to my friends, talk to me But we are never, ever, ever, ever Getting back together We (Ooh-ooh-ooh-ooh-ooh, ooh-ooh-ooh, no) Getting back together We (Ooh-ooh-ooh-ooh-ooh, oh, oh) Getting back together (Yeah) You go talk to your friends, talk to my friends, talk to me (Talk to me) But we are never, ever, ever, ever Getting back together",,"{""happy"": 0.133, ""sad"": 0.333, ""calm"": 0.067, ""romantic"": 0.2, ""dark"": 0.0, ""aggressive"": 0.267}",sad
1891454316,I Knew You Were Trouble (Taylor's Version),Taylor Swift,,English,,,"作词 : Taylor Swift/Max Martin/Shellback 作曲 : Taylor Swift/Max Martin/Shellback Once upon a time, a few mistakes ago I was in your sights, you got me alone You found me, you found me, you found me I guess you didn't care, and I guess I liked that And when I fell hard, you took a step back Without me, without me, without me And he's long gone when he's next to me And I realize the blame is on me 'Cause I knew you were trouble when you walked in So shame on me now Flew me to places I'd never been 'Til you put me down, oh I knew you were trouble when you walked in So shame on me now Flew me to places I'd never been Now I'm lying on the cold hard ground Oh, oh-oh Trouble, trouble, trouble Oh, oh-oh Trouble, trouble, trouble No apologies, he'll never see you cry Pretends he doesn't know that he's the reason why You're drowning, you're drowning, you're drowning And I heard you moved on from whispers on the street A new notch in your belt is all I'll ever be And now I see, now I see, now I see He was long gone when he met me And I realize the joke is on me, hey I knew you were trouble when you walked in (Oh) So shame on me now Flew me to places I'd never been 'Til you put me down, oh I knew you were trouble when you walked in So shame on me now Flew me to places I'd never been (Yeah) Now I'm lying on the cold hard ground Oh, oh-oh (Yeah) Trouble, trouble, trouble Oh, oh-oh Trouble, trouble, trouble And the saddest fear Comes creeping in That you never loved me Or her, or anyone, or anything Yeah I knew you were trouble when you walked in So shame on me now Flew me to places I'd never been (Never been) 'Til you put me down, oh I knew you were trouble when you walked in (Knew it right there) So shame on me now (Knew it right there) Flew me to places I'd never been (Ooh) Now I'm lying on the cold hard ground Oh, oh-oh Trouble, trouble, trouble (Oh) Oh, oh-oh Trouble, trouble, trouble I knew you were trouble when you walked in Trouble, trouble, trouble I knew you were trouble when you walked in Trouble, trouble, trouble",,"{""happy"": 0.043, ""sad"": 0.304, ""calm"": 0.087, ""romantic"": 0.13, ""dark"": 0.261, ""aggressive"": 0.174}",sad
