ID,name,artist,style,language,BPM,instrument,lyrics,label,emotion_json,dominant_emotion
1891456146,All Too Well (10 Minute Version) (Taylor's Version) (From The Vault),Taylor Swift,,English,,,"作词 : Taylor Swift/Liz Rose 作曲 : Taylor Swift/Liz Rose 制作人 : Christopher Roy/Jack Antonoff I walked through the door with you, the air was cold But something ’bout it felt like home somehow And I left my scarf there at your sister’s house And you’ve still got it in your drawer, even now Oh, your sweet disposition and my wide-eyed gaze We’re singing in the car, getting lost upstate Autumn leaves falling down like pieces into place And I can picture it after all these days And I know it’s long gone and That magic’s not here no more And I might be okay, but I’m not fine at all Oh, oh, oh ‘Cause there we are again on that little town street You almost ran the red ’cause you were lookin’ over at me Wind in my hair, I was there I remember it all too well Photo album on the counter, your cheeks were turning red You used to be a little kid with glasses in a twin-sized bed And your mother’s telling stories ’bout you on the tee-ball team You told me’bout your past, thinking your future was me And you were tossing me the car keys **** the patriarchy Keychain on the ground We were always skipping town And I was thinking on the drive down Anytime now he’s gonna say it’s love You never called it what it was Till we were dead and gone and buried Check the pulse and come back swearing It’s the same After three months in the grave And then you wonder where it went to As I reached for you But all I felt was shame And you held my lifeless frame And I know it’s long gone and There was nothing else I could do And I forget about you long enough To forget why I needed to ‘Cause there we are again in the middle of the night We’re dancing ‘round the kitchen in the refrigerator light Down the stairs, I was there I remember it all too well And there we are again When nobody had to know You kept me like a secret But I kept you like an oath Sacred prayer and we’d swear To remember it all too well Maybe we got lost in translation Maybe I asked for too much But maybe this thing was a masterpiece ‘Til you tore it all up Running scared, I was there I remember it all too well And you call me up again Just to break me like a promise So casually cruel in the name of being honest I’m a crumpled up piece of paper lying here ‘Cause I remember it all, all, all They say “All’s well that ends well” But I’m in a new hell everytime You double-cross my mind You said if we had been closer in age Maybe it would’ve been fine And that made me want to die The idea you had of me, who was she? A never-needy, ever-lovely jewel, whose shine reflects on you Not weeping in a party bathroom Some actress asking me what happened You, that’s what happened, you You who charmed my dad with self-effacing jokes Sipping coffee like you’re on a late night show But then he watched me watch the front door all night willing you to come And he said it’s supposed to be fun turning 21 Time won’t fly, it’s like I’m paralyzed by it I’d like to be my old self again But I’m still trying to find it After plaid shirt days and nights when you made me your own Now you mail back my things and I walk home alone But you keep my old scarf from that very first week ‘Cause it reminds you of innocence And it smells like me You can’t get rid of it ‘Cause you remember it all too well, yeah ‘Cause there we are again when I loved you so Back before you lost the one real thing you’ve ever known It was rare, I was there, I remember it all too well Wind in my hair, you were there, you remember it all Down the stairs, you were there, you remember it all It was rare, I was there, I remember it all too well And I was never good at telling jokes but the punchline goes “I’ll get older but your lovers stay my age” From when your Brooklyn broke my skin and bones I’m a soldier who’s returning half her weight And did the twin flame bruise paint you blue? Just between us, did the love affair maim you too? Cause in this city’s barren cold, I still remember the first fall of snow And how it glistened as it fell, I remember it all too well Just between us, did the love affair maim you all too well? Just between us, do you remember it all too well? Just between us, I remember it all too well… Down the stairs ,I was there ,I was there Sacred prayer , I was there , I was there It was rare ,you remember it all Wind in my hair, I was there, I was there Down the stairs, I was there, I was there Sacred prayer, I was there, I was there It was rare, you remember it, all too well Wind in my hair, I was there, I was there Down the stairs, I was there, I was there Sacred prayer, I was there, I was there It was rare, you remember it, all too well Wind in my hair, I was there, I was there Down the stairs, I was there, I was there Sacred prayer, I was there, I was there It was rare, you remember it，",,"{""happy"": 0.111, ""sad"": 0.222, ""calm"": 0.148, ""romantic"": 0.259, ""dark"": 0.185, ""aggressive"": 0.074}",romantic
1465111714,the 1,Taylor Swift,,English,,,"作词 : Taylor Swift/Aaron Dessner 作曲 : Taylor Swift/Aaron Dessner I’m doing good I’m on some new shit Been saying “yes” instead of “no” I thought I saw you at the bus stop I didn’t though I hit the ground running each night I hit the Sunday matinée You know the greatest films of all time Were never made I guess you never know, never know And if you wanted me you really should’ve showed And if you never bleed you’re never gonna grow And it’s alright now But we were something, Don’t you think so? Roaring twenties, tossing pennies in the pool And if my wishes came true It would’ve been you In my defense I have none For never leaving well enough alone But it would’ve been fun If you would’ve been the one I have this dream You’re doing cool shit Having adventures on your own You meet some woman on the Internet And take her home We never painted by the numbers, baby But we were making it count You know the greatest loves of all time are over now I guess you never know, never know And it’s another day waking up alone But we were something, Don’t you think so? Roaring twenties, tossing pennies in the pool And if my wishes came true It would’ve been you In my defense I have none For never leaving well enough alone But it would’ve been fun If you would’ve been the one I persist and resist the temptation to ask you If one thing had been different Would everything be different today? We were something Don’t you think so? Rosé flowing with your chosen family And it would've been sweet If it could've been me In my defense I have none For digging up the grave another time But it would’ve been fun If you would’ve been the one Written by Taylor Swift and Aaron Dessner © 2020 TASRM Publishing, administered by Songs Of Universal, Inc. (BMI), Ingrid Stella Music, administered by SonyATV Tunes LLC (ASCAP) All Rights Reserved. Used By Permission. Produced by Aaron Dessner Recorded by Jonathan Low and Aaron Dessner at Long Pond (Hudson Valley, NY) Vocals recorded by Laura Sisk at the Kitty Committee Studio (Los Angeles, CA) Mixed by Jonathan Low at Long Pond (Hudson Valley, NY) Mastered by Randy Merrill at Sterling Sound (New York, NY) Piano, Acoustic Guitar, Electric Guitar, Drum Programming, Mellotron, OP1 and Synth Bass by Aaron Dessner (Hudson Valley, NY) Orchestration by Bryce Dessner (Biarritz, FR) Synthesizer and OP1 by Thomas Bartlett (The Dwelling; New York, NY) recorded by Thomas Bartlett Percussion by Jason Treuting (Princeton, NJ) recorded by Jason Treuting Viola and Violin by Yuki Numata Resnick (Buffalo, NY) recorded by Kyle Resnick",,"{""happy"": 0.136, ""sad"": 0.273, ""calm"": 0.182, ""romantic"": 0.227, ""dark"": 0.136, ""aggressive"": 0.045}",sad
1465111971,betty,Taylor Swift,,English,,,"编曲 : Taylor Swift/William Bowery 作词 : Taylor Swift/William Bowery 作曲 : Taylor Swift/William Bowery Betty, I won’t make assumptions about why you switched your homeroom But I think it’s cause of me Betty, one time I was riding on my skateboard when I passed your house It’s like I couldn’t breathe You heard the rumors from Inez You can’t believe a word she says Most times - but this time it was true The worst thing that I ever did Was what I did to you But if I just showed up at your party Would you have me? Would you want me? Would you tell me to go **** myself Or lead me to the garden? In the garden would you trust me If I told you it was just a summer thing? I’m only seventeen I don’t know anything But I know I miss you Betty, I know where it all went wrong your favorite song was playing from the far side of the gym I was nowhere to be found, I hate the crowds, you know that Plus, I saw you dance with him You heard the rumors from Inez You can’t believe a word she says Most times - but this time it was true The worst thing that I ever did Was what I did to you But if I just showed up at your party Would you have me? Would you want me? Would you tell me to go **** myself Or lead me to the garden? In the garden would you trust me If I told you it was just a summer thing? I’m only seventeen I don’t know anything But I know I miss you I was walking home on broken cobblestones Just thinking of you when she pulled up Like a figment of my worst intentions She said “James, get in, let’s drive” Those days turned into nights Slept next to her but I dreamt of you all summer long Betty, I’m here on your doorstep And I planned it out for weeks now but it’s finally sinking in Betty, right now is the last time I can dream about what happens when you see my face again The only thing I wanna do Is make it up to you So, I showed up at your party... Yeah, I showed up at your party... Yeah, I showed up at your party Will you have me? Will you love me? Will you kiss me on the porch in front of all your stupid friends? If you kiss me Will it be just like I dreamed it? Will it patch your broken wings? I’m only seventeen I don’t know anything But I know I miss you Standing in your cardigan Kissing in my car again Stopped at a streetlight You know I miss you betty Written by Taylor Swift & William Bowery © 2020 TASRM Publishing, administered by Songs Of Universal, Inc. (BMI), William Bowery Music Publishing, administered by Songs Of Universal, Inc. (BMI) All Rights Reserved. Used By Permission. Produced by Aaron Dessner, Jack Antonoff, and Taylor Swift Recorded by Laura Sisk at the Kitty Committee Studio (Los Angeles, CA), Jack Antonoff at Rough Customer Studio (Brooklyn, NY) Assistant Engineering by John Rooney, Recorded by Jonathan Low and Aaron Dessner at Long Pond (Hudson Valley, NY) Mixed by Serban Ghenea at Mixstar Studios (Virginia Beach, VA) Engineered by John Hanes Mastered by Randy Merrill at Sterling Sound (New York, NY) Drums, Percussion, Bass, Electric and Acoustic Guitars, Organ, Mellotron by Jack Antonoff at Rough Customer Studio (Brooklyn, NY) Percussion, Piano, Bass, High String Guitar and Electric Guitar by Aaron Dessner (Hudson Valley, NY) Mellotron, Pedal Steel, Wurlitzer, Harpsichord, Vibraphone, Electric Guitar by Mikey Freedom Hart at Hook and Fade (Brooklyn, NY) Saxophones, Clarinet by Evan Smith at Pleasure Hill Recording (Portland, ME) Harmonica, Electric Guitar and Lap Steel by Josh Kaufman, recorded by Josh Kaufman (New York, NY)",,"{""happy"": 0.13, ""sad"": 0.261, ""calm"": 0.174, ""romantic"": 0.304, ""dark"": 0.087, ""aggressive"": 0.043}",romantic
1465114457,the last great american dynasty,Taylor Swift,,English,,,"作词 : Taylor Swift/Aaron Dessner 作曲 : Taylor Swift/Aaron Dessner Rebekah rode up on the afternoon train. It was sunny Her saltbox house on the coast took her mind off St. Louis Bill was the heir to the Standard Oil name and money And the town said ""How did a middle class divorcée do it?"" The wedding was charming If a little gauche There's only so far new money goes They picked out a home and called it ""Holiday House"" Their parties were tasteful If a little loud The doctor had told him to settle down It must have been her fault his heart gave out And they said There goes the last great American dynasty Who knows if she never showed up what could've been There goes the maddest woman this town has ever seen She had a marvelous time ruining everything Rebekah gave up on the Rhode Island set Forever Flew in all her Bitch Pack friends from the city Filled the pool with champagne and swam with the big names and blew through the money on the boys and the ballet And losing on card game bets with Dalí And they said There goes the last great American dynasty Who knows if she never showed up what could've been There goes the most shameless woman this town has ever seen She had a marvelous time ruining everything They say She was seen on occasion Pacing the rocks staring out at the midnight sea And in a feud with her neighbor she stole his dog and dyed it key lime green 50 years is a long time Holiday House sat quietly on that beach Free of women with madness, their men and bad habits Then it was bought by me Who knows if I never showed up what could've been There goes the loudest woman this town has ever seen I had a marvelous time ruining everything I had a marvelous time ruining everything A marvelous time Ruining everything A marvelous time I had a marvelous time Written by Taylor Swift and Aaron Dessner © 2020 TASRM Publishing, administered by Songs Of Universal, Inc. (BMI), Ingrid Stella Music, administered by SonyATV Tunes LLC (ASCAP) All Rights Reserved. Used By Permission. Produced by Aaron Dessner Recorded by Jonathan Low and Aaron Dessner at Long Pond (Hudson Valley, NY) Vocals recorded by Laura Sisk at the Kitty Committee Studio (Los Angeles, CA) Mixed by Jonathan Low at Long Pond (Hudson Valley, NY) Mastered by Randy Merrill at Sterling Sound (New York, NY) Drum Programming, Percussion, Piano, Electric Guitar, Slide Guitar, Bass, Synthesizer and Keyboards by Aaron Dessner (Hudson Valley, NY) Orchestration by Rob Moose (Brooklyn, NY) and Bryce Dessner (Biarritz, FR) Drums by JT Bates (Salon Studio; St. Paul, MN) recorded by JT Bates Violin and Viola by Rob Moose (Brooklyn, NY) recorded by Rob Moose",,"{""happy"": 0.176, ""sad"": 0.235, ""calm"": 0.118, ""romantic"": 0.059, ""dark"": 0.294, ""aggressive"": 0.118}",dark
1465111917,august,Taylor Swift,,English,,,"作词 : Taylor Swift/Jack Antonoff 作曲 : Taylor Swift/Jack Antonoff 编曲 : Jack Antonoff 制作人 : Taylor Swift/Jack Antonoff/Joe Alwyn Salt air And the rust on your door I never needed anything more Whispers of “Are you sure?” “Never have I ever before” But I can see us lost in the memory August slipped away into a moment in time Cause it was never mine And I can see us twisted in bedsheets August sipped away like a bottle of wine Cause you were never mine Your back beneath the sun Wishing I could write my name on it Will you call when you’re back at school? I remember thinking I had you But I can see us lost in the memory August slipped away into a moment in time Cause it was never mine And I can see us twisted in bedsheets August sipped away like a bottle of wine Cause you were never mine Back when we were still changing for the better Wanting was enough For me it was enough To live for the hope of it all Cancel plans just in case you’d call And say “Meet me behind the mall” So much for summer love, and saying “us” Cause you weren’t mine to lose You weren’t mine to lose No But I can see us lost in the memory August slipped away into a moment in time Cause it was never mine And I can see us twisted in bedsheets August sipped away like a bottle of wine Cause you were never mine Cause you were never mine Never mine Do you remember? Remember when I pulled up And said “Get in the car” And then canceled my plans just in case you’d call Back when I was living for the hope of it all For the hope of it all, “Meet me behind the mall” Remember when I pulled up And said “Get in the car” And then canceled my plans just in case you’d call Back when I was living for the hope of it all For the hope of it all For the hope of it all For the hope of it all For the hope of it all Written by Taylor Swift & Jack Antonoff 2020 TASRM Publishing, administered by Songs Of Universal, Inc. (BMI), Sony/ATV Songs LLC / Ducky Donath Music (BMI) All Rights Reserved. Used By Permission. Produced by Jack Antonoff and Taylor Swift Recorded by Laura Sisk at the Kitty Committee Studio (Los Angeles, CA) and Jack Antonoff at Rough Customer Studio (Brooklyn, NY) Mixed by Jonathan Low at Long Pond (Hudson Valley, NY) Mastered by Randy Merrill at Sterling Sound (New York, NY) Live Drums, Percussion Programming, Electric and Acoustic Guitars, Keyboards, Bass by Jack Antonoff at Rough Customer Studio (Brooklyn, NY) Saxophones, Flute, Electric Guitar, Keyboards by Evan Smith at Pleasure Hill Recording (Portland, ME) Strings by Bobby Hawk, recorded by Mike Williams and Jon Gautier at Sound House Recording (Lakeland, FL) Synth Bass by Jonathan Low, recorded by Jonathan Low at Long Pond (Hudson Valley, NY)",,"{""happy"": 0.143, ""sad"": 0.286, ""calm"": 0.19, ""romantic"": 0.238, ""dark"": 0.095, ""aggressive"": 0.048}",sad
1465114515,illicit affairs,Taylor Swift,,English,,,"作词 : Taylor Swift/Jack Antonoff 作曲 : Taylor Swift/Jack Antonoff Make sure nobody sees you leave Hood over your head Keep your eyes down Tell your friends you’re out for a run You’ll be flushed when you return Take the road less traveled by Tell yourself you can always stop What started in beautiful rooms Ends with meetings in parking lots And that’s the thing about illicit affairs And clandestine meetings And longing stares It’s born from just one single glance But it dies and it dies and it dies ...a million little times Leave the perfume on the shelf That you picked out just for him So you leave no trace behind Like you don’t even exist Take the words for what they are A dwindling, mercurial high A drug that only worked The first few hundred times And that’s the thing about illicit affairs And clandestine meetings And stolen stares They show their truth one single time But they lie and they lie and they lie ...a million little times And you wanna scream Don’t call me kid Don’t call me baby Look at this godforsaken mess that you made me You showed me colors you know I can’t see with anyone else Don’t call me kid Don’t call me baby Look at this idiotic fool that you made me You taught me a secret language I can’t speak with anyone else And you know damn well For you I would ruin myself ...a million little times © 2020 TASRM Publishing, administered by Songs Of Universal, Inc. (BMI), Sony/ATV Songs LLC/ Ducky Donath Music (BMI) All Rights Reserved. Used By Permission. Produced by Jack Antonoff and Taylor Swift Recorded by Laura Sisk at the Kitty Committee Studio (Los Angeles, CA) and Jack Antonoff at Rough Customer Studio (Brooklyn, NY) Mixed by Serban Ghenea at Mixstar Studios (Virginia Beach, VA) Engineered by John Hanes Mastered by Randy Merrill at Sterling Sound (New York, NY) Live Drums, Percussion Programming, Electric Guitars, Keyboards, Bass, Background Vocals by Jack Antonoff at Rough Customer Studio (Brooklyn, NY) Accordion, Saxophones, Electric Guitar, Keyboards, Background Vocals by Evan Smith at Pleasure Hill Recording (Portland, ME) Pedal Steel by Mikey Freedom Hart at Hook and Fade (Brooklyn, NY)",,"{""happy"": 0.038, ""sad"": 0.269, ""calm"": 0.115, ""romantic"": 0.231, ""dark"": 0.192, ""aggressive"": 0.154}",sad
1465114469,my tears ricochet,Taylor Swift,,English,,,"作词 : Taylor Swift 作曲 : Taylor Swift We gather here We line up weeping in a sunlit room And if I’m on fire You’ll be made of ashes, too Even on my worst day Did I deserve, babe All the hell you gave me? Cause I loved you I swear I loved you Til my dying day I didn’t have it in myself to go with grace And you’re the hero flying around saving face And if I’m dead to you why are you at the wake? Cursing my name Wishing I stayed Look at how my tears ricochet We gather stones Never knowing what they’ll mean Some to throw Some to make a diamond ring You know I didn’t want to Have to haunt you But what a ghostly scene You wear the same jewels That I gave you As you bury me I didn’t have it in myself to go with grace Cause when I’d fight, you used to tell me I was brave And if I’m dead to you why are you at the wake? Cursing my name Wishing I’d stayed Look at how my tears ricochet And I can go anywhere I want Anywhere I want Just not home And you can aim for my heart, go for blood But you would still miss me in your bones And I still talk to you When I’m screaming at the sky And when you can’t sleep at night you hear my stolen lullabies I didn’t have it in myself to go with grace And so the battleships will sink beneath the waves You had to kill me, but it killed you just the same Cursing my name Wishing I stayed You turned into your worst fears And you’re Tossing out blame Drunk on this pain Crossing out the good years And you’re cursing my name Wishing I stayed Look at how my tears ricochet © 2020 TASRM Publishing, administered by Songs Of Universal, Inc. (BMI) All Rights Reserved. Used By Permission. Produced by Jack Antonoff and Taylor Swift Recorded by Laura Sisk at the Kitty Committee Studio (Los Angeles, CA), Jack Antonoff at Rough Customer Studio (Brooklyn, NY) and Laura Sisk and Jack Antonoff at Electric Lady Studios (New York, NY) and Conway Recording (Los Angeles, CA) Assistant Engineering by John Rooney and Jon Sher Mixed by Serban Ghenea at Mixstar Studios (Virginia Beach, VA) Engineered by John Hanes Mastered by Randy Merrill at Sterling Sound (New York, NY) Live Drums, Percussion, Programming, Electric Guitars, Keyboards, Piano, Bass, Background Vocals by Jack Antonoff at Rough Customer Studio (Brooklyn, NY) and Electric Lady Studios (New York, NY) and Conway Recording (Los Angeles, CA) Saxophones, Keyboards, Programming by Evan Smith at Pleasure Hill Recording (Portland, ME) Strings by Bobby Hawk, recorded by Lorenzo Wolff at Restoration Sound (Brooklyn, NY)",,"{""happy"": 0.04, ""sad"": 0.32, ""calm"": 0.08, ""romantic"": 0.12, ""dark"": 0.28, ""aggressive"": 0.16}",sad
2092285037,Style (Taylor's Version),Taylor Swift,,English,,,作词 : Taylor Swift/Ali Payami/Max Martin/Shellback 作曲 : Taylor Swift/Ali Payami/Max Martin/Shellback Midnight You come and pick me up no headlights A long drive Could end in burning flames or paradise Fade into view oh it's been a while since I have even Heard from you heard from you I should just tell you to leave 'cause I Know exactly where it leads but I Watch us go 'round and 'round each time You got that James Dean daydream look in your eye And I got that red lip classic thing that you like And when we go crashing down we come back every time 'Cause we never go out of style We never go out of style You got that long hair slicked back white t-shirt And I got that good girl faith and a tight little skirt And when we go crashing down we come back every time 'Cause we never go out of style We never go out of style So it goes He can't keep his wild eyes on the road Takes me home The lights are off he's taking off his coat I say I heard oh that you've been out and about With some other girl some other girl He says what you heard is true but I Can't stop thinking about you and I I said I've been there too a few times 'Cause you got that James Dean daydream look in your eye And I got that red lip classic thing that you like And when we go crashing down we come back every time 'Cause we never go out of style We never go out of style You got that long hair slicked back white t-shirt And I got that good girl faith and a tight little skirt And when we go crashing down we come back every time 'Cause we never go out of style We never go out of style Take me home Just take me home yeah Just take me home Out of style You got that James Dean daydream look in your eye And I got that red lip classic thing that you like And when we go crashing down we come back every time 'Cause we never go out of style We never go out of style,,"{""happy"": 0.187, ""sad"": 0.25, ""calm"": 0.125, ""romantic"": 0.375, ""dark"": 0.062, ""aggressive"": 0.0}",romantic
